,wayfair ,,,amazon,,
item,description,price ,link,description,price ,link
1,Andover Mills Revere Nightstand ,$77.99,http://www.wayfair.com/Andover-Mills-Revere-Nightstand-409942-ANDO1052.html,Sauder Shoal Creek Night Stand ,$69.35,http://www.amazon.com/Sauder-Shoal-Creek-Night-Stand/dp/B0042JZ6MW/ref=lp_3733251_1_2?s=furniture&ie=UTF8&qid=1417465573&sr=1-2
2,Newport Home Furnishings Hummer Console Reclining Loveseat,$809.99,http://www.wayfair.com/Newport-Home-Furnishings-Hummer-Console-Reclining-Loveseat-V4350-DHQW1013.html,Homelegance 9636-2 Laurelton Textured Plush Microfiber Dual Glider Recliner Love Seat with Console Chocolate Brown,$749.00,http://www.amazon.com/Homelegance-9636-2-Laurelton-Microfiber-Chocolate/dp/B00G6IFBY0/ref=lp_3733571_1_3?s=furniture&ie=UTF8&qid=1417465774&sr=1-3
3,"OIA Metro 29.75"" x 13"" Bathroom Shelf",$42.99,http://www.wayfair.com/OIA-Metro-29.75-x-13-Bathroom-Shelf-16983-IAB1137.html,Organize It All Metro 4-Tier Shelf (16984),$44.69,http://www.amazon.com/Organize-It-All-4-Tier-16984/dp/B002YK4XXO/ref=lp_335116011_1_5?s=hardware&ie=UTF8&qid=1417466167&sr=1-5
4,Bacova Guild Jessica Simpson Zig Bath Rug,$26.99,http://www.wayfair.com/Bacova-Guild-Jessica-Simpson-Zig-Bath-Rug-80489E-80490E-BCGD1022.html,Bacova Guild Jessica Simpson Zig Cotton Bath Rug Purple Chevron Stripe,$26.99,http://www.amazon.com/Bacova-Guild-Jessica-Simpson-Chevron/dp/B00OTH5WI0/ref=sr_1_11?s=bedbath&ie=UTF8&qid=1417466903&sr=1-11
5,"Akerue 17"" Portable Tabletop Gas Grill",$64.99,http://www.wayfair.com/Akerue-Industries-17-Portable-Tabletop-Gas-Grill-30005-AKE1017.html,"17"" Portable Tabletop Gas Grill",$64.99,http://www.amazon.com/17-Portable-Tabletop-Gas-Grill/dp/B00GK762P4/ref=sr_1_6?s=lawn-garden&ie=UTF8&qid=1417467392&sr=1-6
6,OXO 10 Piece Pop Container Set,$99.95,http://www.wayfair.com/OXO-10-Piece-Pop-Container-Set-1165700-OXO1130.html,OXO 10-Piece Good Grips Pop Containers Set,$99.95,http://www.amazon.com/OXO-Grips-10-Piece-Container-White/dp/B0029096ZO/ref=sr_1_5?s=kitchen&ie=UTF8&qid=1417470201&sr=1-5
7,Jonathan Adler Charade Cloud Vase ,$68.00,http://www.wayfair.com/Jonathan-Adler-Charade-Cloud-Vase-8263-XJA1549.html,Jonathan Adler Cloud Bud Vase,$68.00,http://www.amazon.com/Jonathan-Adler-Cloud-Bud-Vase/dp/B00BCL4G1A/ref=sr_1_7?s=furniture&ie=UTF8&qid=1417470856&sr=1-7
8,Adesso Goliath 1 Light Arched Floor Lamp,$111.99,http://www.wayfair.com/Adesso-Goliath-1-Light-Arched-Floor-Lamp-5098-01-5098-22-AE1930.html,Adesso 5098-01 Goliath Arc Lamp Black,$104.74,http://www.amazon.com/Adesso-5098-01-Goliath-Lamp-Black/dp/B007RM4I20/ref=sr_1_13?s=hi&ie=UTF8&qid=1417471356&sr=1-13
9,Majestic Home Products Vertical Stripe Bean Bag Chair,$99.99,http://www.wayfair.com/Majestic-Home-Products-Vertical-Stripe-Bean-Bag-Chair-859072240-JZZ2362.html,Majestic Home Goods Bean Bag Navy Blue Vertical Strip Small,$93.66,http://www.amazon.com/Majestic-Home-Goods-Vertical-Strip/dp/B00ACE0VV2/ref=sr_1_1?s=furniture&ie=UTF8&qid=1417471767&sr=1-1
10,PetFusion Deluxe Cat Scratcher Lounge,$49.95,http://www.wayfair.com/PetFusion-Deluxe-Cat-Scratcher-Lounge-PETF1000.html,PetFusion Cat Scratcher Lounge - Deluxe,$49.95,http://www.amazon.com/PetFusion-Cat-Scratcher-Lounge-Walnut/dp/B004X6UEH6/ref=lp_2975243011_1_23?s=pet-supplies&ie=UTF8&qid=1417471955&sr=1-23